{
  "asset_id": "global_contradiction_patterns.v1.json",
  "asset_path": "rules/global_contradiction_patterns.v1.json",
  "asset_type": "rule_library",
  "domain": "global",
  "version": "v1",
  "status": "approved",
  "sources": [
    "contradictions.zip"
  ],
  "decision": "normalized_and_approved",
  "decision_reason": "Strukturierte Widerspruchsmuster sind direkt wiederverwendbar.",
  "reuse_policy": "May be loaded by validation/gating and taxonomy steps.",
  "created_at": "2026-03-07T00:00:00Z",
  "updated_at": "2026-03-07T00:00:00Z",
  "review_notes": []
}